{"version":"1.0","recipe_id":"P1-C02-recipe-v1","sku":"yb-bb-03","direction_id":"comment_faq","structure_id":"P6","support_type":"faq","content_role":"graphic_support","need_id":"吸水性字段怎么理解","fact_snapshot_ref":"fact-p1-v1","claim_ids":[],"evidence_ids":["absorbency_field"],"visual_action":"吸水性字段怎么理解","asset_slots":["product_full_view"],"control_variables":{"fixed":["sku","fact_snapshot","brand_visual_system"],"variable":[]},"allowed_wording":[],"forbidden_wording":["检测证明","保证","绝对不掉毛","100%抗菌"],"cta":null,"semantic_sha256":"80c128081eda7eebdb9c30e84fb04192c04f70029764c02a8e681e1eee84e1aa","artifact_sha256":"82885d0e738ce3ecdaf523fe27991a352eb51e54c27e299b4d709a20b6d68564"}