{"version":"1.0","recipe_id":"P2-B02-recipe-v1","sku":"yb-bb-12","direction_id":"healing_ritual","structure_id":"P2","support_type":"trust","content_role":"life_context","need_id":"洗澡后整理洗手台","fact_snapshot_ref":"fact-p2-v1","claim_ids":[],"evidence_ids":["real_use_action"],"visual_action":"洗澡后整理洗手台","asset_slots":["use_context"],"control_variables":{"fixed":["sku","fact_snapshot","brand_visual_system"],"variable":[]},"allowed_wording":[],"forbidden_wording":["检测证明","保证","绝对不掉毛","100%抗菌"],"cta":null,"semantic_sha256":"c0bf45a847c44b92a2d8d7ccd9cd007a47e1714ec507f1db2ce8d4299a4e94ec","artifact_sha256":"8381278513ba5f5600cdcf77f29cc70d1d1fbac6527cefac594127a5bd7bbbbe"}