{"version":"1.0","recipe_id":"P1-B03-recipe-v1","sku":"yb-bb-03","direction_id":"healing_ritual","structure_id":"P2","support_type":"trust","content_role":"life_context","need_id":"睡前整理","fact_snapshot_ref":"fact-p1-v1","claim_ids":[],"evidence_ids":["real_use_action"],"visual_action":"睡前整理","asset_slots":["use_context"],"control_variables":{"fixed":["sku","fact_snapshot","brand_visual_system"],"variable":[]},"allowed_wording":[],"forbidden_wording":["检测证明","保证","绝对不掉毛","100%抗菌"],"cta":null,"semantic_sha256":"73f9d41bf4323e61d8b6a3ae3ca15b5ad01180a9d0426505182288e192ee05f7","artifact_sha256":"3fac208f3560ee5b519ba31ea4126bf30f128e775c45af91462d067ca33d28cf"}