{"version":"1.0","recipe_id":"P2-B01-recipe-v1","sku":"yb-bb-12","direction_id":"healing_ritual","structure_id":"P2","support_type":"trust","content_role":"life_context","need_id":"洗手后擦干并挂回","fact_snapshot_ref":"fact-p2-v1","claim_ids":[],"evidence_ids":["real_use_action"],"visual_action":"洗手后擦干并挂回","asset_slots":["use_context"],"control_variables":{"fixed":["sku","fact_snapshot","brand_visual_system"],"variable":[]},"allowed_wording":[],"forbidden_wording":["检测证明","保证","绝对不掉毛","100%抗菌"],"cta":null,"semantic_sha256":"92ae782e4997bf590ff9a949c7bb99ab4962c86c049b3b8be56b13767baee312","artifact_sha256":"63583d33665ceae025476e08901a800d66ea832b96551145c02b449fdf98099f"}