{"version":"1.0","recipe_id":"P2-A08-recipe-v1","sku":"yb-bb-12","direction_id":"test_selection","structure_id":"P1","support_type":"experiment","content_role":"product_evidence","need_id":"规格选项怎么选","fact_snapshot_ref":"fact-p2-v1","claim_ids":[],"evidence_ids":["sku_options"],"visual_action":"规格选项怎么选","asset_slots":["product_full_view"],"control_variables":{"fixed":["sku","fact_snapshot","brand_visual_system"],"variable":["单条/组合装"]},"allowed_wording":[],"forbidden_wording":["检测证明","保证","绝对不掉毛","100%抗菌"],"cta":null,"semantic_sha256":"346000412ae8a9e8a25da3fd78fb39a0b2a993854060e7050ee3979774400dbb","artifact_sha256":"1818dd55a1a7bdbff73d8f1e3cbac242bc4228699a317eeda644cc2d8fd350f2"}