{"version":"1.0","recipe_id":"P2-A04-recipe-v1","sku":"yb-bb-12","direction_id":"test_selection","structure_id":"P1","support_type":"experiment","content_role":"product_evidence","need_id":"边缘、标签和做工","fact_snapshot_ref":"fact-p2-v1","claim_ids":[],"evidence_ids":["edge_label"],"visual_action":"边缘、标签和做工","asset_slots":["color_reveal"],"control_variables":{"fixed":["sku","fact_snapshot","brand_visual_system"],"variable":["机位和字幕密度"]},"allowed_wording":[],"forbidden_wording":["检测证明","保证","绝对不掉毛","100%抗菌"],"cta":null,"semantic_sha256":"0cdee541f3792e2edd09bad571c59a47da9da0945b68c1c1c5a8e63f56bc98da","artifact_sha256":"29c36f9e6b088ee0c4b045e450debf8fce84c55c3c941946d81c502b9cc3831a"}