{"version":"1.0","recipe_id":"P2-C03-recipe-v1","sku":"yb-bb-12","direction_id":"comment_faq","structure_id":"P6","support_type":"faq","content_role":"graphic_support","need_id":"当前价格怎么看","fact_snapshot_ref":"fact-p2-v1","claim_ids":[],"evidence_ids":["price_snapshot"],"visual_action":"当前价格怎么看","asset_slots":["product_full_view"],"control_variables":{"fixed":["sku","fact_snapshot","brand_visual_system"],"variable":[]},"allowed_wording":[],"forbidden_wording":["检测证明","保证","绝对不掉毛","100%抗菌"],"cta":null,"semantic_sha256":"4065cb2c97d47f21e9a354b2e3e2b0061ae4654f2fda08069b6e62fee0abd2f4","artifact_sha256":"0e4f3f6c1ccaf43970be46a3a312b576dddaf103744bf0f73bbcde197c9c501e"}