{"version":"1.0","recipe_id":"P2-B08-recipe-v1","sku":"yb-bb-12","direction_id":"healing_ritual","structure_id":"P2","support_type":"trust","content_role":"life_context","need_id":"一天结束后的浴室复位","fact_snapshot_ref":"fact-p2-v1","claim_ids":[],"evidence_ids":["real_use_action"],"visual_action":"一天结束后的浴室复位","asset_slots":["use_context"],"control_variables":{"fixed":["sku","fact_snapshot","brand_visual_system"],"variable":[]},"allowed_wording":[],"forbidden_wording":["检测证明","保证","绝对不掉毛","100%抗菌"],"cta":null,"semantic_sha256":"9945c5a17d5d0ce0933f72747fd9254e4a103126dc0bc3cae353b7a8b8fee85c","artifact_sha256":"7d49c7af0265925dbe02ba5d71e4ccae06e724d1d7ed472dbec48cb0df820834"}