{"version":"1.0","recipe_id":"P2-C01-recipe-v1","sku":"yb-bb-12","direction_id":"comment_faq","structure_id":"P6","support_type":"faq","content_role":"graphic_support","need_id":"抗菌或长绒棉如何核验","fact_snapshot_ref":"fact-p2-v1","claim_ids":[],"evidence_ids":["claim_evidence_map"],"visual_action":"抗菌或长绒棉如何核验","asset_slots":["product_full_view"],"control_variables":{"fixed":["sku","fact_snapshot","brand_visual_system"],"variable":[]},"allowed_wording":[],"forbidden_wording":["检测证明","保证","绝对不掉毛","100%抗菌"],"cta":null,"semantic_sha256":"f90b5a7bd445e6c0eb009c10dbc617ca8daa3fc24c703d449a84da1b4bd2ddb4","artifact_sha256":"15eff870fa6d82c4c5858b7adfc84816f23a037dd939474a8ea6751d84234118"}