{"version":"1.0","recipe_id":"P2-A03-recipe-v1","sku":"yb-bb-12","direction_id":"test_selection","structure_id":"P1","support_type":"experiment","content_role":"product_evidence","need_id":"织纹与双面毛圈","fact_snapshot_ref":"fact-p2-v1","claim_ids":[],"evidence_ids":["weave_macro"],"visual_action":"织纹与双面毛圈","asset_slots":["weave_macro"],"control_variables":{"fixed":["sku","fact_snapshot","brand_visual_system"],"variable":["微距距离"]},"allowed_wording":[],"forbidden_wording":["检测证明","保证","绝对不掉毛","100%抗菌"],"cta":null,"semantic_sha256":"fc304563f16d2bab2a871eba1bc5216157a9a5fd73b5b26aef66cdb47f0fe8ca","artifact_sha256":"ca5775a2399ed8f33c3019f7431fb0d703dce7d63188708218ffaa552d6a48ba"}