{"version":"1.0","recipe_id":"P1-D02-recipe-v1","sku":"yb-bb-03","direction_id":"transaction","structure_id":"P6","support_type":"transaction","content_role":"graphic_support","need_id":"相同机位展示两款","fact_snapshot_ref":"fact-p1-v1","claim_ids":[],"evidence_ids":["same_condition_test"],"visual_action":"相同机位展示两款","asset_slots":["lift_unfold","product_full_view"],"control_variables":{"fixed":["sku","fact_snapshot","brand_visual_system"],"variable":[]},"allowed_wording":[],"forbidden_wording":["检测证明","保证","绝对不掉毛","100%抗菌"],"cta":"查看商品页当前规格与颜色","semantic_sha256":"b4b74d4e6fb194ed3b7adc92a3560fd4253bd44db23d9c65ebfe37b57986a9d2","artifact_sha256":"6ff9454629a73b644f0db0d6cd47987e62d7ad6cc2af05a6c4539ce07f1ea3c0"}