{"version":"1.0","recipe_id":"P1-C05-recipe-v1","sku":"yb-bb-03","direction_id":"comment_faq","structure_id":"P6","support_type":"faq","content_role":"graphic_support","need_id":"不掉毛或不起球评论如何看","fact_snapshot_ref":"fact-p1-v1","claim_ids":[],"evidence_ids":["review_snapshot"],"visual_action":"不掉毛或不起球评论如何看","asset_slots":["use_context"],"control_variables":{"fixed":["sku","fact_snapshot","brand_visual_system"],"variable":[]},"allowed_wording":[],"forbidden_wording":["检测证明","保证","绝对不掉毛","100%抗菌"],"cta":null,"semantic_sha256":"3b8c020ba39eebd6607ff15a276c69253056c686591b0985741c21751bf24380","artifact_sha256":"c3557d292dfae1fa23a881c413d35e6daaf11b3d568badf3281453044aa5c752"}