{"version":"1.0","recipe_id":"P2-D04-recipe-v1","sku":"yb-bb-12","direction_id":"transaction","structure_id":"P6","support_type":"transaction","content_role":"graphic_support","need_id":"人工与AI辅助剪辑","fact_snapshot_ref":"fact-p2-v1","claim_ids":[],"evidence_ids":["production_log"],"visual_action":"人工与AI辅助剪辑","asset_slots":["use_context","product_full_view"],"control_variables":{"fixed":["sku","fact_snapshot","brand_visual_system"],"variable":[]},"allowed_wording":[],"forbidden_wording":["检测证明","保证","绝对不掉毛","100%抗菌"],"cta":"查看商品页当前规格与颜色","semantic_sha256":"7807c2200a7ba35c1b81a31117d896715e21e7b2c6cf3c36e27bcc6880070490","artifact_sha256":"8c1f5fce16b80bc7983cfda268f80b0b8afc40058b606a42ae294c6bb188de01"}