{"version":"1.0","recipe_id":"P1-A11-recipe-v1","sku":"yb-bb-03","direction_id":"test_selection","structure_id":"P1","support_type":"experiment","content_role":"product_evidence","need_id":"页面宣称与证据边界","fact_snapshot_ref":"fact-p1-v1","claim_ids":[],"evidence_ids":["claim_evidence_map"],"visual_action":"页面宣称与证据边界","asset_slots":["product_full_view"],"control_variables":{"fixed":["sku","fact_snapshot","brand_visual_system"],"variable":["页面写了什么/还要核对什么"]},"allowed_wording":[],"forbidden_wording":["检测证明","保证","绝对不掉毛","100%抗菌"],"cta":null,"semantic_sha256":"dcf88fc0025e2bd38fb5f09ef9bd0f2165d19d05c4af3b66344eea214056f9b2","artifact_sha256":"d4e9c89dd78db4624139ab0e1f866a395dbd06c8e2ca0fac8eb213f9bc89095d"}