{"version":"1.0","recipe_id":"P1-C04-recipe-v1","sku":"yb-bb-03","direction_id":"comment_faq","structure_id":"P6","support_type":"faq","content_role":"graphic_support","need_id":"触肤即干或超强吸水文案","fact_snapshot_ref":"fact-p1-v1","claim_ids":[],"evidence_ids":["sku_option_copy"],"visual_action":"触肤即干或超强吸水文案","asset_slots":["color_reveal"],"control_variables":{"fixed":["sku","fact_snapshot","brand_visual_system"],"variable":[]},"allowed_wording":[],"forbidden_wording":["检测证明","保证","绝对不掉毛","100%抗菌"],"cta":null,"semantic_sha256":"d77c92eaa1b8350e0acfc097574fe584299008560645b24668a89c26ff7c6bd2","artifact_sha256":"29184f92b8839a953e29aeff709b2a339332a642a2df180b3e4231d6b6e4001b"}