{"version":"1.0","recipe_id":"P1-B04-recipe-v1","sku":"yb-bb-03","direction_id":"relationship_story","structure_id":"P3","support_type":"trust","content_role":"life_context","need_id":"来客前准备独立挂位","fact_snapshot_ref":"fact-p1-v1","claim_ids":[],"evidence_ids":["real_use_action"],"visual_action":"来客前准备独立挂位","asset_slots":["use_context"],"control_variables":{"fixed":["sku","fact_snapshot","brand_visual_system"],"variable":[]},"allowed_wording":[],"forbidden_wording":["检测证明","保证","绝对不掉毛","100%抗菌"],"cta":null,"semantic_sha256":"03c0cf585b65a52fa8f16f11931578fa3f9f9e8d3a7166574da5bc84458b90e8","artifact_sha256":"da1d50c3a537c19d367e221b2874cea2c49ec120cdb7f36033c90d8dbe2992c8"}