{"version":"1.0","recipe_id":"P2-A10-recipe-v1","sku":"yb-bb-12","direction_id":"test_selection","structure_id":"P1","support_type":"experiment","content_role":"product_evidence","need_id":"购买前检查表","fact_snapshot_ref":"fact-p2-v1","claim_ids":[],"evidence_ids":["page_fact_card"],"visual_action":"购买前检查表","asset_slots":["product_full_view"],"control_variables":{"fixed":["sku","fact_snapshot","brand_visual_system"],"variable":["材质/棉含量/货号/颜色"]},"allowed_wording":[],"forbidden_wording":["检测证明","保证","绝对不掉毛","100%抗菌"],"cta":null,"semantic_sha256":"d3aa4334047330b54368e5de9a94dd9a4669e9cb391ee49348015dba9b57d668","artifact_sha256":"cb17cbea91e2a1ac7bc4d985cb6d6bd57f295fc7173335239de97e06a60869fd"}