{"version":"1.0","recipe_id":"P2-D03-recipe-v1","sku":"yb-bb-12","direction_id":"transaction","structure_id":"P6","support_type":"transaction","content_role":"graphic_support","need_id":"颜色和组合选购","fact_snapshot_ref":"fact-p2-v1","claim_ids":[],"evidence_ids":["sku_color_options"],"visual_action":"颜色和组合选购","asset_slots":["color_reveal"],"control_variables":{"fixed":["sku","fact_snapshot","brand_visual_system"],"variable":[]},"allowed_wording":[],"forbidden_wording":["检测证明","保证","绝对不掉毛","100%抗菌"],"cta":"查看商品页当前规格与颜色","semantic_sha256":"f8d66efdd46def8b03d32d470eb1c1098b13492d804217f4f03cfeeac6cda72a","artifact_sha256":"4b4515b90ee5602a9536c8a2b15e58984aef0a8bbb658e8ab8d278aa75358212"}