{"version":"1.0","recipe_id":"P2-A07-recipe-v1","sku":"yb-bb-12","direction_id":"test_selection","structure_id":"P1","support_type":"experiment","content_role":"product_evidence","need_id":"页面参数清单","fact_snapshot_ref":"fact-p2-v1","claim_ids":[],"evidence_ids":["page_params_snapshot"],"visual_action":"页面参数清单","asset_slots":["product_full_view"],"control_variables":{"fixed":["sku","fact_snapshot","brand_visual_system"],"variable":["逐项/一次出现"]},"allowed_wording":[],"forbidden_wording":["检测证明","保证","绝对不掉毛","100%抗菌"],"cta":null,"semantic_sha256":"7cb539fd8babfe010d123ff6b6fefb839641a3ebaf3743888e9640dd303538e3","artifact_sha256":"def32da62651ed5edc6c826dbe8dc47045a66b77522c571003fe9aab1b084c48"}