{"version":"1.0","recipe_id":"P2-A05-recipe-v1","sku":"yb-bb-12","direction_id":"test_selection","structure_id":"P1","support_type":"experiment","content_role":"product_evidence","need_id":"展开、折叠与收纳","fact_snapshot_ref":"fact-p2-v1","claim_ids":[],"evidence_ids":["fold_storage"],"visual_action":"展开、折叠与收纳","asset_slots":["fold_fall"],"control_variables":{"fixed":["sku","fact_snapshot","brand_visual_system"],"variable":["展开先行/折叠先行"]},"allowed_wording":[],"forbidden_wording":["检测证明","保证","绝对不掉毛","100%抗菌"],"cta":null,"semantic_sha256":"7d2c9677ac7e84fd3658b2a75baf82198abe72be385c926e918354f47959b867","artifact_sha256":"b9e92101119fe139a507d9996c5df2c2aeda82f9a013014b88aeabe8d743f2b6"}