{"version":"1.0","recipe_id":"P2-D01-recipe-v1","sku":"yb-bb-12","direction_id":"transaction","structure_id":"P6","support_type":"transaction","content_role":"graphic_support","need_id":"两款按场景选择","fact_snapshot_ref":"fact-p2-v1","claim_ids":[],"evidence_ids":["same_condition_test"],"visual_action":"两款按场景选择","asset_slots":["lift_unfold","product_full_view"],"control_variables":{"fixed":["sku","fact_snapshot","brand_visual_system"],"variable":[]},"allowed_wording":[],"forbidden_wording":["检测证明","保证","绝对不掉毛","100%抗菌"],"cta":"查看商品页当前规格与颜色","semantic_sha256":"de6fd8ec3794619e3d9e246aa38d34f12e22dd0dc9528084d8b5c90f8a1dc038","artifact_sha256":"9d0be725245666a4ff33a5bafd36b5863f27420987e4c0e9028b6a6007f1ea9a"}