{"version":"1.0","recipe_id":"P2-B07-recipe-v1","sku":"yb-bb-12","direction_id":"healing_ritual","structure_id":"P2","support_type":"trust","content_role":"life_context","need_id":"使用后折叠收纳","fact_snapshot_ref":"fact-p2-v1","claim_ids":[],"evidence_ids":["fold_storage"],"visual_action":"使用后折叠收纳","asset_slots":["fold_fall"],"control_variables":{"fixed":["sku","fact_snapshot","brand_visual_system"],"variable":[]},"allowed_wording":[],"forbidden_wording":["检测证明","保证","绝对不掉毛","100%抗菌"],"cta":null,"semantic_sha256":"b1f691509d8bb77e0da0cb2e3c827f8e41898891d5d9259a4a57cee4b7d52bf9","artifact_sha256":"1e1264c09508858ad4195453a40694098c32c234cdceedc00955c2f255e9cabe"}