{"version":"1.0","recipe_id":"P1-A09-recipe-v1","sku":"yb-bb-03","direction_id":"test_selection","structure_id":"P1","support_type":"experiment","content_role":"product_evidence","need_id":"页面厚度字段","fact_snapshot_ref":"fact-p1-v1","claim_ids":[],"evidence_ids":["thickness_field"],"visual_action":"页面厚度字段","asset_slots":["product_full_view"],"control_variables":{"fixed":["sku","fact_snapshot","brand_visual_system"],"variable":["P1加厚款/P2标准款"]},"allowed_wording":[],"forbidden_wording":["检测证明","保证","绝对不掉毛","100%抗菌"],"cta":null,"semantic_sha256":"270ba132e37a571d647cc2a49e992088cfa4ed624003328bfe0a09008e0d7ea9","artifact_sha256":"c5486bc0e32f922a21d05fe9bb76223bbebd6ac1e832b19d187ecf48481ee498"}