{"version":"1.0","recipe_id":"P2-B06-recipe-v1","sku":"yb-bb-12","direction_id":"healing_ritual","structure_id":"P2","support_type":"trust","content_role":"life_context","need_id":"早晨出门前使用","fact_snapshot_ref":"fact-p2-v1","claim_ids":[],"evidence_ids":["real_use_action"],"visual_action":"早晨出门前使用","asset_slots":["use_context"],"control_variables":{"fixed":["sku","fact_snapshot","brand_visual_system"],"variable":[]},"allowed_wording":[],"forbidden_wording":["检测证明","保证","绝对不掉毛","100%抗菌"],"cta":null,"semantic_sha256":"62c48c2b6dbc66ce6ea204a41ea51049e7d6a8cfb3c69596011051fe7d72b509","artifact_sha256":"7c5187d9ab1117f8d6aed3ef90f99014bfe09d748fd73e2907f075155dd667d7"}